[
  {
    "slug": "manufacturing-and-production",
    "category": "Manufacturing & Production",
    "workday_internal_names": ["Operations", "Real Estate & Facilities"],
    "icon_raw": "https://www.taylor.com/hubfs/__Taylor.com%20-%20All%20files%20connected%20to%20main%20site%20and%20blogs/03%20Careers%20Center/NEW%20Careers%202026/Browse%20Jobs/Subdomain/Manufacturing-Production-Blue-Icon.svg",
    "icon_badge": "https://www.taylor.com/hubfs/__Taylor.com%20-%20All%20files%20connected%20to%20main%20site%20and%20blogs/03%20Careers%20Center/NEW%20Careers%202026/Browse%20Jobs/Categories/Manufacturing-Production-Circle-Icon.svg",
    "heading": "Manufacturing & Production Jobs",
    "description": "Taylor offers a range of manufacturing and production jobs, including press operation, finishing and packaging roles supporting large-scale print operations.",
    "featured_image": "https://www.taylor.com/hubfs/__Taylor.com%20-%20All%20files%20connected%20to%20main%20site%20and%20blogs/03%20Careers%20Center/NEW%20Careers%202026/Browse%20Jobs/Categories/Manufacturing-Production-Jobs-Image.webp",
    "meta_title": "Manufacturing & Production | Search Jobs at Taylor | Taylor",
    "meta_description": "Explore manufacturing and production jobs. Discover careers with strong benefits, growth paths and a workplace where your work and well-being matter.",
    "similar_categories": [
      "Technology",
      "Supply Chain & Logistics",
      "Engineering",
      "Business Operations"
    ],
    "faqs": []
  },
  {
    "slug": "technology",
    "category": "Technology",
    "workday_internal_names": ["IT"],
    "icon_raw": "https://www.taylor.com/hubfs/__Taylor.com%20-%20All%20files%20connected%20to%20main%20site%20and%20blogs/03%20Careers%20Center/NEW%20Careers%202026/Browse%20Jobs/Subdomain/Technology-IT-Blue-Icon.svg",
    "icon_badge": "https://www.taylor.com/hubfs/__Taylor.com%20-%20All%20files%20connected%20to%20main%20site%20and%20blogs/03%20Careers%20Center/NEW%20Careers%202026/Browse%20Jobs/Categories/Technology-IT-Circle-Icon.svg",
    "heading": "Technology Jobs",
    "description": "Taylor offers a range of technology and IT jobs that provide opportunities to work on impactful projects, including developing custom applications and managing enterprise resource planning systems, that drive meaningful change throughout the company.",
    "featured_image": "https://www.taylor.com/hubfs/__Taylor.com%20-%20All%20files%20connected%20to%20main%20site%20and%20blogs/03%20Careers%20Center/NEW%20Careers%202026/Browse%20Jobs/Categories/Technology-IT-Jobs-Image.webp",
    "meta_title": "Technology | Search Technology Jobs at Taylor | Taylor",
    "meta_description": "Explore technology and IT roles. Discover careers with strong benefits, growth paths and a collaborative workplace where your work and well-being matter.",
    "similar_categories": [
      "Marketing & Creative",
      "Supply Chain & Logistics",
      "Engineering",
      "Business Operations"
    ],
    "faqs": []
  },
  {
    "slug": "sales",
    "category": "Sales",
    "workday_internal_names": ["Sales & Sales Support"],
    "icon_raw": "https://www.taylor.com/hubfs/__Taylor.com%20-%20All%20files%20connected%20to%20main%20site%20and%20blogs/03%20Careers%20Center/NEW%20Careers%202026/Browse%20Jobs/Subdomain/Sales-Blue-Icon.svg",
    "icon_badge": "https://www.taylor.com/hubfs/__Taylor.com%20-%20All%20files%20connected%20to%20main%20site%20and%20blogs/03%20Careers%20Center/NEW%20Careers%202026/Browse%20Jobs/Categories/Sales-Circle-Icon.svg",
    "heading": "Sales Jobs",
    "description": "Taylor offers a range of sales and account management jobs focused on building client relationships, supporting customer needs, and driving growth and revenue across large-scale print operations.",
    "featured_image": "https://www.taylor.com/hubfs/__Taylor.com%20-%20All%20files%20connected%20to%20main%20site%20and%20blogs/03%20Careers%20Center/NEW%20Careers%202026/Browse%20Jobs/Categories/Sales-Jobs-Image.webp",
    "meta_title": "Sales & Account Management | Search Jobs at Taylor | Taylor",
    "meta_description": "Explore sales and sales support roles. Discover careers with strong benefits, growth paths and a collaborative workplace where your work and well-being matter.",
    "similar_categories": [
      "Customer Service",
      "Supply Chain & Logistics",
      "Finance & Accounting",
      "Business Operations"
    ],
    "faqs": []
  },
  {
    "slug": "engineering",
    "category": "Engineering",
    "workday_internal_names": ["Engineering"],
    "icon_raw": "https://www.taylor.com/hubfs/__Taylor.com%20-%20All%20files%20connected%20to%20main%20site%20and%20blogs/03%20Careers%20Center/NEW%20Careers%202026/Browse%20Jobs/Subdomain/Engineering-Blue-Icon.svg",
    "icon_badge": "https://www.taylor.com/hubfs/__Taylor.com%20-%20All%20files%20connected%20to%20main%20site%20and%20blogs/03%20Careers%20Center/NEW%20Careers%202026/Browse%20Jobs/Categories/Engineering-Circle-Icon.svg",
    "heading": "Engineering Jobs",
    "description": "Taylor offers a range of engineering jobs to help design, build and optimize state-of-the-art solutions for complex print and production challenges, including automating manufacturing workflows and developing new product capabilities.",
    "featured_image": "https://www.taylor.com/hubfs/__Taylor.com%20-%20All%20files%20connected%20to%20main%20site%20and%20blogs/03%20Careers%20Center/NEW%20Careers%202026/Browse%20Jobs/Categories/Engineering-Jobs-Image.webp",
    "meta_title": "Engineering | Search Engineering Jobs at Taylor | Taylor",
    "meta_description": "Explore engineering roles. Discover careers with strong benefits, growth paths and a collaborative workplace where your work and well-being matter.",
    "similar_categories": [
      "Technology",
      "Supply Chain & Logistics",
      "Manufacturing & Production",
      "Business Operations"
    ],
    "faqs": []
  },
  {
    "slug": "human-resources",
    "category": "Human Resources",
    "workday_internal_names": ["Human Resources"],
    "icon_raw": "https://www.taylor.com/hubfs/__Taylor.com%20-%20All%20files%20connected%20to%20main%20site%20and%20blogs/03%20Careers%20Center/NEW%20Careers%202026/Browse%20Jobs/Subdomain/Human-Resources-Blue-Icon.svg",
    "icon_badge": "https://www.taylor.com/hubfs/__Taylor.com%20-%20All%20files%20connected%20to%20main%20site%20and%20blogs/03%20Careers%20Center/NEW%20Careers%202026/Browse%20Jobs/Categories/Human-Resources-Circle-Icon.svg",
    "heading": "Human Resources Jobs",
    "description": "Taylor offers a range of human resources jobs dedicated to talent acquisition and employee relations, strengthening workplace operations and shaping workplace culture.",
    "featured_image": "https://www.taylor.com/hubfs/__Taylor.com%20-%20All%20files%20connected%20to%20main%20site%20and%20blogs/03%20Careers%20Center/NEW%20Careers%202026/Browse%20Jobs/Categories/Human-Resources-Jobs-Image.webp",
    "meta_title": "Human Resources | Search HR Jobs at Taylor | Taylor",
    "meta_description": "Explore human resources roles. Discover careers with strong benefits, growth paths and a collaborative workplace where your work and well-being matter.",
    "similar_categories": [
      "Business Operations",
      "Customer Service",
      "Supply Chain & Logistics",
      "Technology"
    ],
    "faqs": []
  },
  {
    "slug": "supply-chain-and-logistics",
    "category": "Supply Chain & Logistics",
    "workday_internal_names": ["Supply Chain Management"],
    "icon_raw": "https://www.taylor.com/hubfs/__Taylor.com%20-%20All%20files%20connected%20to%20main%20site%20and%20blogs/03%20Careers%20Center/NEW%20Careers%202026/Browse%20Jobs/Subdomain/Supply-Chain-Logistics-Blue-Icon.svg",
    "icon_badge": "https://www.taylor.com/hubfs/__Taylor.com%20-%20All%20files%20connected%20to%20main%20site%20and%20blogs/03%20Careers%20Center/NEW%20Careers%202026/Browse%20Jobs/Categories/Supply-Chain-Logistics-Circle-Icon.svg",
    "heading": "Supply Chain & Logistics Jobs",
    "description": "Taylor offers a wide range of supply chain and logistics jobs in the sourcing, procurement, inventory control and logistics coordination fields in support of supporting large-scale print operations.",
    "featured_image": "https://www.taylor.com/hubfs/__Taylor.com%20-%20All%20files%20connected%20to%20main%20site%20and%20blogs/03%20Careers%20Center/NEW%20Careers%202026/Browse%20Jobs/Categories/Supply-Chain-Logistics-Jobs-Image.webp",
    "meta_title": "Supply Chain & Logistics | Search Jobs at Taylor | Taylor",
    "meta_description": "Explore supply and logistics roles. Discover careers with strong benefits, growth paths and a collaborative workplace where your work and well-being matter.",
    "similar_categories": [
      "Technology",
      "Engineering",
      "Business Operations",
      "Finance & Accounting"
    ],
    "faqs": []
  },
  {
    "slug": "finance-and-accounting",
    "category": "Finance & Accounting",
    "workday_internal_names": ["Finance"],
    "icon_raw": "https://www.taylor.com/hubfs/__Taylor.com%20-%20All%20files%20connected%20to%20main%20site%20and%20blogs/03%20Careers%20Center/NEW%20Careers%202026/Browse%20Jobs/Subdomain/Finance-Accounting-Blue-Icon.svg",
    "icon_badge": "https://www.taylor.com/hubfs/__Taylor.com%20-%20All%20files%20connected%20to%20main%20site%20and%20blogs/03%20Careers%20Center/NEW%20Careers%202026/Browse%20Jobs/Categories/Finance-Accounting-Circle-Icon.svg",
    "heading": "Finance & Accounting Jobs",
    "description": "Taylor offers a range of finance and accounting jobs focused on managing financial operations including planning, budgeting and reporting that drive business performance across large-scale print operations.",